{
  "$comment": "Manifest v2, kind=scene. 데이터만으로 이루어진 Scene 패키지 — 코드가 한 줄도 없고, Player가 읽어 화면을 세운다. 이 저장소가 실제로 도는 모듈을 담을 수 있는지 확인하는 GUI 시험대이기도 하다: 화면에 한 줄만 있으면 무엇이 깨졌을 때 그것이 배선의 문제임이 분명해진다.",
  "schemaVersion": 2,
  "id": "io.terra.scene.hello",
  "name": "Hello Terra",
  "version": "0.1.0",
  "kind": "scene",
  "description": "화면 한가운데에 Hello Terra 한 줄을 띄우는 최소 Scene 모듈. Store도 Function도 Operation도 없어서, 이것이 뜨지 않으면 원인은 Scene 내용이 아니라 로드·기여·포장 중 하나다.",
  "compatibility": {
    "products": ["leaf", "tree"],
    "os": ["linux", "windows"]
  },
  "entrypoints": {
    "scene": "scene/scene.json"
  },
  "contributions": {
    "gui": {
      "scenes": [
        {
          "id": "io.terra.scene.hello",
          "entry": "scene/scene.json",
          "role": "application"
        }
      ]
    }
  }
}
