{
  "schemaVersion": 2,
  "id": "lab.stellaxia.node-gui",
  "version": "0.4.3",
  "kind": "scene",
  "name": "Terra 노드",
  "description": "게임 GUI 형태의 Terra 노드 화면(시작 화면 · 육각 필드 맵 · 조타륜 · 노드 자원 · 연결 · 도로 · 오버헤드 패널 · 편집기). base가 곧장 띄우는 main GUI다. 얇은 Scene(frame + 로그인 Route)이 같은 모듈의 embed 웹 앱(ui/index.html 시작 화면 → 노드 화면)을 terra.web/frame으로 감싼다.",
  "compatibility": {
    "products": ["leaf", "tree"],
    "os": ["linux", "windows"]
  },
  "entrypoints": {
    "scene": "scene/scene.json"
  },
  "contributions": {
    "gui": {
      "scenes": [
        {
          "id": "lab.stellaxia.node-gui.ui",
          "entry": "scene/scene.json",
          "role": "application",
          "branch": "main"
        }
      ],
      "apps": [
        {
          "id": "lab.stellaxia.node-gui.web",
          "name": "Terra 노드",
          "mode": "static",
          "entry": "ui/index.html",
          "isolation": "sandboxed",
          "embed": "scene",
          "permissions": [
            "session.identity",
            "node.read",
            "node.control",
            "file.read",
            "file.write",
            "process.execute",
            "module.manage"
          ]
        }
      ]
    }
  }
}
