{
  "$comment": "Terra 통합 base Scene module (Manifest v2, kind=scene). leaf·tree를 가르지 않는 하나의 GUI이자, 이 노드에 설치된 모듈로 들어가는 런처다. io.terra.scene.leaf·io.terra.scene.tree를 대체하며, 게이트웨이가 둘을 application으로 강등한다.",
  "schemaVersion": 2,
  "id": "io.terra.scene.terra",
  "name": "Terra Scene",
  "version": "0.1.0",
  "kind": "scene",
  "description": "The one GUI: a base Scene that serves leaf and tree alike. Every screen reads the node through product-neutral terra.gateway.* operations, so nothing in the package asks which role it is running on.",
  "compatibility": {
    "products": [
      "leaf",
      "tree"
    ],
    "os": [
      "linux",
      "windows"
    ]
  },
  "entrypoints": {
    "scene": "scene/scene.json"
  },
  "contributions": {
    "gui": {
      "scenes": [
        {
          "id": "io.terra.scene.terra",
          "entry": "scene/scene.json",
          "role": "base"
        }
      ]
    }
  }
}
